{
  "schemaVersion": 1,
  "catalogId": "arbi-parts",
  "description": "Canonical engineering parts. Quantities live only in physical assembly usages.",
  "parts": [
    {
      "id": "as5600-angle-sensor",
      "name": "AS5600 magnetic angle sensor + magnet",
      "baseUnit": "each",
      "kind": "component",
      "lifecycle": "planned",
      "disciplines": [
        "electronics"
      ],
      "traits": [
        "off-the-shelf"
      ],
      "requirements": [
        "Optional dancer/tension sensing for cable-compliance mechanism; not required to block first V1 motion prototype."
      ]
    },
    {
      "id": "bearing-608-2rs",
      "name": "608-2RS sealed bearing",
      "baseUnit": "each",
      "kind": "component",
      "lifecycle": "active",
      "disciplines": [
        "mechanical"
      ],
      "traits": [
        "off-the-shelf"
      ],
      "requirements": [
        "8×22×7 mm rubber-sealed bearings. Two per independent drum support plus extras for guides/tensioners."
      ]
    },
    {
      "id": "bulk-capacitor-1000uf",
      "name": "1000 µF 5 V rail bulk capacitor",
      "baseUnit": "each",
      "kind": "component",
      "lifecycle": "active",
      "disciplines": [
        "electronics"
      ],
      "traits": [
        "off-the-shelf"
      ],
      "requirements": [
        "Low-ESR capacitor sized/rated appropriately above 5 V; one installed + spare; buffers servo-current spikes."
      ],
      "designWarnings": [
        {
          "severity": "critical",
          "code": "capacitor-retention-unverified",
          "message": "The compact pod uses a bolted insulated cup/rim retainer. Actual can diameter, height, vent clearance, lead isolation, print retention and physical loads remain unverified."
        }
      ]
    },
    {
      "id": "cable-gland-assortment",
      "name": "IP68 cable gland assortment",
      "baseUnit": "each",
      "kind": "consumable",
      "lifecycle": "active",
      "disciplines": [
        "electrical"
      ],
      "traits": [
        "cable",
        "off-the-shelf"
      ],
      "requirements": [
        "Mix M12/M16/M20 for cabinet, post-driver boxes and dock/pod wiring."
      ]
    },
    {
      "id": "camera-gimbal",
      "name": "Pan/tilt camera gimbal",
      "baseUnit": "each",
      "kind": "component",
      "lifecycle": "active",
      "disciplines": [
        "mechanical",
        "optics"
      ],
      "traits": [
        "fabricated",
        "printed"
      ],
      "requirements": [
        "Lightweight 2-axis Camera Module 3 gimbal; approx. ±90° pan and 0–70° tilt target."
      ],
      "fabrication": {
        "process": "openscad",
        "modelStatus": "concept-unvalidated",
        "sources": [
          {
            "path": "hardware/assemblies/camera-pod/camera-pod-integrated-camera-cradle.scad",
            "module": "camera_pod_integrated_camera_cradle",
            "modelId": "camera-pod-integrated-camera-cradle",
            "revision": "0.2.0"
          },
          {
            "path": "hardware/assemblies/camera-pod/camera-pod-integrated-tilt-pivot-support.scad",
            "module": "camera_pod_integrated_tilt_pivot_support",
            "modelId": "camera-pod-integrated-tilt-pivot-support",
            "revision": "0.2.0"
          },
          {
            "path": "hardware/assemblies/camera-pod/camera-pod-horn-retainer.scad",
            "module": "camera_pod_horn_retainer",
            "modelId": "camera-pod-horn-retainer",
            "revision": "0.1.0"
          },
          {
            "path": "hardware/assemblies/camera-pod/camera-pod-servo-fit-coupon.scad",
            "module": "camera_pod_servo_fit_coupon",
            "modelId": "camera-pod-servo-fit-coupon",
            "revision": "0.1.1"
          },
          {
            "path": "hardware/assemblies/camera-pod/camera-pod-integrated-camera-hood.scad",
            "module": "camera_pod_integrated_camera_hood",
            "modelId": "camera-pod-integrated-camera-hood",
            "revision": "0.2.0"
          },
          {
            "path": "hardware/assemblies/camera-pod/camera-pod-integrated-gimbal-head.scad",
            "module": "camera_pod_integrated_gimbal_head",
            "modelId": "camera-pod-integrated-gimbal-head",
            "revision": "0.2.0"
          },
          {
            "path": "hardware/assemblies/camera-pod/camera-pod-integrated-gimbal-carrier.scad",
            "module": "camera_pod_integrated_gimbal_carrier",
            "modelId": "camera-pod-integrated-gimbal-carrier",
            "revision": "0.3.0"
          }
        ]
      },
      "notes": "Current compact enclosure uses head, reinforced cradle, pivot support and optical hood at r0.2.0, carrier r0.3.0 with removable pan harness clamps, and unchanged horn retainers. Historical concept and dry bench gimbal parts, fixed fairing, tilt-servo boot and rear camera cowl are archived and excluded from this BOM. Four M3 x 12 clamp stacks join head and carrier; four M2 x 8 rear camera screws engage captive front nuts without camera washers. The selected kit exports 16 fabrication models including the optional coupon and installs 18 printed pieces. See hardware/assemblies/camera-pod/camera-pod-enclosure.md for quantities and service routes. Servo/connector dimensions, complete assembly fit, rain protection and complete flying mass remain unverified. The owner accepted the revised servo body/mounting fit on 12 October 2026; see docs/evidence/micro-servo-2026-10-12.md."
    },
    {
      "id": "camera-pod-chassis",
      "name": "Camera pod spider/chassis",
      "baseUnit": "each",
      "kind": "component",
      "lifecycle": "active",
      "disciplines": [
        "mechanical",
        "optics"
      ],
      "traits": [
        "fabricated",
        "printed"
      ],
      "requirements": [
        "ASA/PETG lightweight cable spider and electronics chassis sized for Raspberry Pi 3A+, 48 V → 5 V converter and bulk capacitor fixed on the pod. Complete flying pod target ~100–120 g; hard design limit 170 g."
      ],
      "notes": "Current compact assembly r0.5.0 uses integrated deck and carrier r0.3.0, four new removable retainer models r0.1.0, existing head/cradle/support/optical hood r0.2.0, rain hood r0.3.0 and tray r0.2.3. Six removable prints secure the capacitor, incoming power sleeve and separate fixed/pan CSI and servo anchors without ties. The selected kit has 18 installed prints from 15 model types and 16 fabrication models including its optional coupon. Reprint the deck and carrier from r0.4.0; add one capacitor retainer, one power jaw, two ribbon clamps and two loom clamps. Historical dry-bench sources and publications retain their original configurations. See hardware/assemblies/camera-pod/camera-pod-enclosure.md and docs/assemblies/camera-pod/tie-free-retention.md. Physical acceptance remains open.",
      "fabrication": {
        "process": "openscad",
        "modelStatus": "concept-unvalidated",
        "sources": [
          {
            "path": "hardware/assemblies/camera-pod/camera-pod-spider.scad",
            "module": "camera_pod_spider",
            "modelId": "camera-pod-spider",
            "revision": "0.1.0"
          },
          {
            "path": "hardware/assemblies/camera-pod/camera-pod-pan-servo-mount.scad",
            "module": "camera_pod_pan_servo_mount",
            "modelId": "camera-pod-pan-servo-mount",
            "revision": "0.1.1"
          },
          {
            "path": "hardware/assemblies/camera-pod/camera-pod-rain-hood.scad",
            "module": "camera_pod_rain_hood",
            "modelId": "camera-pod-rain-hood",
            "revision": "0.3.0"
          },
          {
            "path": "hardware/assemblies/camera-pod/camera-pod-enclosure-base.scad",
            "module": "camera_pod_enclosure_base",
            "modelId": "camera-pod-enclosure-base",
            "revision": "0.2.3"
          },
          {
            "path": "hardware/assemblies/camera-pod/camera-pod-integrated-deck.scad",
            "module": "camera_pod_integrated_deck",
            "modelId": "camera-pod-integrated-deck",
            "revision": "0.3.0"
          },
          {
            "path": "hardware/assemblies/camera-pod/camera-pod-capacitor-retainer.scad",
            "module": "camera_pod_capacitor_retainer",
            "modelId": "camera-pod-capacitor-retainer",
            "revision": "0.1.0"
          },
          {
            "path": "hardware/assemblies/camera-pod/camera-pod-power-clamp.scad",
            "module": "camera_pod_power_clamp",
            "modelId": "camera-pod-power-clamp",
            "revision": "0.1.0"
          },
          {
            "path": "hardware/assemblies/camera-pod/camera-pod-ribbon-clamp.scad",
            "module": "camera_pod_ribbon_clamp",
            "modelId": "camera-pod-ribbon-clamp",
            "revision": "0.1.0"
          },
          {
            "path": "hardware/assemblies/camera-pod/camera-pod-loom-clamp.scad",
            "module": "camera_pod_loom_clamp",
            "modelId": "camera-pod-loom-clamp",
            "revision": "0.1.0"
          }
        ]
      },
      "designWarnings": [
        {
          "severity": "critical",
          "code": "retention-unverified",
          "message": "Compact deck/carrier screw-fastened retainers replace ties. Received fit, captive-pocket retention, print strength/creep and complete mass require physical inspection and testing."
        }
      ]
    },
    {
      "id": "capsule-slip-ring-6x2a",
      "name": "Capsule slip ring, ≥6 channels × 2 A",
      "baseUnit": "each",
      "kind": "component",
      "lifecycle": "active",
      "disciplines": [
        "electrical",
        "electronics"
      ],
      "traits": [
        "off-the-shelf"
      ],
      "requirements": [